{
  "schema_version": 1,
  "case": "window-management.set-desktop-show",
  "protocol": {
    "interface": "treeland_window_management_v1",
    "version": 1
  },
  "steps": [
    {
      "bind": {
        "object": "window_management",
        "interface": "treeland_window_management_v1",
        "version": 1
      }
    },
    { "checkpoint": "initial-state" },
    {
      "request": {
        "object": "window_management",
        "name": "set_desktop",
        "args": [1]
      }
    },
    { "client_roundtrip": {} },
    { "checkpoint": "request-state" },
    {
      "request": {
        "object": "window_management",
        "name": "destroy",
        "args": []
      }
    },
    { "client_roundtrip": {} },
    { "disconnect": {} }
  ]
}
