{
  "schema_version": 1,
  "case": "window-management.set-desktop-show",
  "protocol": { "interface": "treeland_window_management_v1", "version": 1 },
  "steps": [
    { "bind": { "object": "window_management", "interface": "treeland_window_management_v1", "version": 1 } },
    { "request": { "object": "window_management", "name": "unknown_request", "args": [] } },
    { "checkpoint": "initial-state" },
    { "disconnect": {} }
  ]
}
